term	definition
What's up? (Mexican informal)	¿qué onda?
What's up? (more informal Mexican)	¿qué tranza?
What's up? (vulgar Mexican)	¿qué pedo?
cool or nice (person, Mexican slang)	buena onda
bad vibes; not cool (Mexican slang)	mala onda
to get it; understand (Mexican slang)	agarrar la onda
long time no see! (Mexican)	¡qué milagro!
What? I didn't catch that (Mexican)	¿mande?
Huh? (Mexican, sounds like ei-oh)	¿ei-oh?
really? for real? (Mexican slang)	¿neta?
the best — esta fiesta es la ___ (Mexican slang)	la neta
really? (Mexican, like ¿neta?)	¿apoco?
no way! come on! (Mexican, mild)	¡no manches!
it doesn't matter; whatever (Mexican)	ni modo
go for it! let's go! wow! (Mexican)	¡órale!
wow! (Mexican exclamation)	¡híjole!
soon; eventually — not always right now (Mexican)	ahorita
right now (Mexican — unlike ahorita)	luego luego
careful! look out! (Mexican slang)	¡aguas!
damn ___ (before a noun, Mexican mild vulgar)	pinche
cool (things or situations, Mexican slang)	chido
cool; great (things, Mexican slang)	está padre
awesome (Mexican slang)	está padrísimo
I agree; it's a deal (Mexican slang)	cámara
it's a deal (stronger, Mexican slang)	conste
no problem (Mexican slang)	no hay bronca
dude (Mexican slang)	güey
yes (Mexican slang)	simón
dude (northern Mexico)	vato
bastard; also friendly dude (Mexican vulgar)	cabrón
countryman (Baja California slang)	paisa
buddy; compadre shortened (Mexican)	compa
close friend; like a brother (Mexican slang)	carnal
close friend (Mexican slang)	cuate
kid; young guy (Mexican slang)	chavo
young woman; girl (Mexican slang)	chava
kid (Mexican slang)	chamaco
little kids (Mexican)	peques
spoiled brat; kid (Mexican slang)	escuincle
old person (Mexican slang)	ruco
old guy acting young (Mexican slang)	chavoruco
old guy chasing young women (Mexican slang)	rabo verde
low-class attitude; like redneck (Mexican slang)	naco
stuck-up; preppy (Mexican slang)	fresa
cheesy music or taste (Mexican slang)	música fresona
cheesy (Mexican)	cursi
picky, especially about food (Mexican)	especial
Mexican-American (slang)	chicano
person from Mexico City (slang)	chilango
Mexico City (what locals call it)	D.F.
Mexican hip-hop kid (slang)	cholo
left-wing SJW type, insult (Mexican)	chairo
right-wing type, insult (Mexican)	derechairo
overly religious person, insult (Mexican)	mocho
terrible driver (Mexican slang)	cafre
beat-up car (Mexican slang)	carcacha
busted junk (Mexican slang)	cacharro
nerd (Mexican slang)	ñoño
busybody (Mexican slang)	metiche
gossipy person (Mexican slang)	chismoso
gossip (Mexican)	chisme
henpecked; bossed by partner (Mexican slang)	mandilón
someone with your same name (Mexican)	tocayo
stingy (Mexican slang)	codo
talk too much (Mexican expression)	hablar por los codos
hot; attractive (Mexican slang)	buena
really hot (Mexican slang)	bien buena
hot; good-looking woman (Mexican slang)	chula
dirty; disgusting; rude (Mexican)	cochino
softer way to say dirty (Mexican)	cochinito
bald guy, nickname (Mexican)	pelón
dirty look; sour face (Mexican slang)	jeta
woman with a resting bitch-face (Mexican slang)	jetona
dad; literally my boss (Mexican slang)	mi jefe
mom; literally my boss (Mexican slang)	mi jefa
my old lady; wife or girlfriend (Mexican)	mi vieja
old ladies, nicer (Mexican)	viejitas
this woman, often dismissive (Mexican)	esta vieja
old man; also dude among friends (Mexican)	viejo
my son (mi hijo, Mexican)	mijo
light-skinned woman with light hair (Mexican)	güera
light-skinned man with light hair (Mexican)	güero
it's fucking awesome (Mexican vulgar)	está chingón
it's fucked up (Mexican vulgar)	está de la chingada
euphemism for está de la chingada (Mexican)	de la fregada
there's a ton of ___ (Mexican vulgar)	hay un chingo de
a lot of (non-vulgar Mexican)	un montón de
I don't give a fuck (Mexican vulgar)	me vale madres
no fucking way (Mexican vulgar)	ni madres
awesome; feeling great (Mexican vulgar)	a toda madre
that sucks (Mexican vulgar)	qué poca madre
a mess; fucked-up situation (Mexican vulgar)	desmadre
no way! don't suck me off (Mexican vulgar)	¡no mames!
picky; stuck-up (Mexican vulgar)	mamón
muscular; jacked (Mexican slang)	mamado
it's tough; hard (Mexican slang)	está cabrón
pissed off (Mexican slang)	encabronado
this guy pisses me off (Mexican slang)	me encabrona
tough situation, mixed company (Mexican)	está cañón
damn! shit! (Mexican slang)	¡chale!
hell yeah! of course! (Mexican slang)	¡a huevo!
I'm feeling lazy (Mexican slang)	tengo hueva
lazy person (Mexican slang)	huevón
this bores me (Mexican slang)	me da hueva
how boring (Mexican slang)	¡qué hueva!
beer (Mexican slang)	chela
beers (Mexican slang)	cheves
big returnable beer bottle (Mexican)	caguama
tall boy beer can (Mexican)	latón
liquor bottle (Mexican slang)	pomo
half-gallon liquor bottle (Mexican slang)	pata de elefante
booze (Mexican vulgar slang)	pisto
to drink; get drunk (Mexican vulgar)	pistear
let's drink (Mexican vulgar)	vamos a chupar
bad drunk (Mexican slang)	mala copa
hungover (Mexican slang)	crudo
I have a hangover (Mexican)	tengo cruda
bar (Mexican)	cantina
nightclub (Mexican)	antro
banda-music cowboy nightclub (Mexican)	rodeo
I'm drunk (Mexican slang)	estoy pedo
big drinker; also big fart (Mexican vulgar)	pedote
drinking binge (Mexican slang)	peda
drinking binge (Mexican)	borrachera
party; drinking session (Mexican slang)	pachanga
no problem (vulgar Mexican)	no hay pedo
what's your fucking problem? (Mexican vulgar)	¿cuál es tu pinche pedo?
person who causes problems (Mexican slang)	pedero
euphemism for pedo (Mexican)	pex
song (Mexican slang)	rola
the band; crew of friends (Mexican slang)	la banda
job, often a grind (Mexican slang)	chamba
what job do you have? (Mexican slang)	¿qué chamba tienes?
to work without enthusiasm (Mexican)	chambear
small shop or store (Mexican slang)	changarro
monkey (Mexican)	chango
cheap; low quality (Mexican slang)	chafa
money; bucks in pesos (Mexican slang)	varos
money (Mexican slang, wool)	lana
money (Mexican slang, silver)	plata
soda (Mexican)	refresco
police bribe, euphemism (Mexican)	un refresco
favor (Mexican slang)	paro
do me a favor (Mexican slang)	hazme un paro
joke; also the trick is... (Mexican)	chiste
vulgar pun (Mexican)	albur
to make vulgar puns (Mexican)	alburear
ugly; bad (Mexican slang)	gacho
ridiculous; over the top (Mexican)	jalada
diarrhea (Mexican slang)	chorro
thief (Mexican slang)	ratero
criminal; rat (Mexican slang)	rata
VW Beetle nickname (Mexican)	vocho
jacket in Mexico — not chaqueta (Mexican)	chamarra
jerking off (Mexican slang — not jacket!)	chaqueta
sandals (Mexican)	chanclas
sandals; also the food (Mexican)	huaraches
wearing sandals, sloppy (Mexican slang)	chancludo
main plaza of a city (Mexican)	el zócalo
neighborhood (Mexican)	colonia
apartment (Mexican slang)	depa
bus in Mexico (not truck)	camión
speed bump (Mexican)	tope
